image,caption,preprocessed_captions
0O6Y0KZWFW09.jpg,the mountain is covered in snow and has pine trees around it and the sky is light blue with one big cloud,"['mountain', 'cover', 'snow', 'pine', 'tree', 'around', 'sky', 'light', 'blue', 'one', 'big', 'cloud']"
0QTEJOJ004PV.jpg,icy mountains covered with snow and pine trees with a completely clear light blue sky,"['ici', 'mountain', 'cover', 'snow', 'pine', 'tree', 'complet', 'clear', 'light', 'blue', 'sky']"
0QY19OA99006.jpg,black mountains with snow on top and a blue sky with no clouds,"['black', 'mountain', 'snow', 'top', 'blue', 'sky', 'cloud']"
0RUD5KV988MJ.jpg,green pine covered mountain ranges where the sky is foggy and white,"['green', 'pine', 'cover', 'mountain', 'rang', 'sky', 'foggi', 'white']"
0SUMMO61WLH5.jpg,a mountain with lots of lush green vegetation where the sky is pretty and blue,"['mountain', 'lot', 'lush', 'green', 'veget', 'sky', 'pretti', 'blue']"
0SW8P24R7P6W.jpg,mountains range covered with snow with a slight yellow and blue clear sky,"['mountain', 'rang', 'cover', 'snow', 'slight', 'yellow', 'blue', 'clear', 'sky']"
0T23O5WY3PPS.jpg,a single rocky mountains surrounded by greenery and a clear and blue sky,"['singl', 'rocki', 'mountain', 'surround', 'greeneri', 'clear', 'blue', 'sky']"
0UPDPZ1BZDOC.jpg,brown mountains with rugged peaks with an off white sky with some clouds,"['brown', 'mountain', 'rug', 'peak', 'white', 'sky', 'cloud']"
0W4R84FA7AK7.jpg,a mountain with pointy peaks and pine forest vegetation around it and a blue sky with thick clouds,"['mountain', 'pointi', 'peak', 'pine', 'forest', 'veget', 'around', 'blue', 'sky', 'thick', 'cloud']"
0YUGWKF89K6G.jpg,black mountains with really sharp peaks and green vegetation and the sky is blue with some clouds,"['black', 'mountain', 'realli', 'sharp', 'peak', 'green', 'veget', 'sky', 'blue', 'cloud']"
0ZHH1YNH9YQJ.jpg,stone grey mountain with pine trees around it and the sky is blue with scattered clouds,"['stone', 'grey', 'mountain', 'pine', 'tree', 'around', 'sky', 'blue', 'scatter', 'cloud']"
1A4Y75CC6NWP.jpg,mountain ranges which are grey and have rocky surroundings with a white sky covered with clouds,"['mountain', 'rang', 'grey', 'rocki', 'surround', 'white', 'sky', 'cover', 'cloud']"
1ASL986U9L2W.jpg,mountain ranges covered with ice and pine trees where the sky is cloudy and white,"['mountain', 'rang', 'cover', 'ice', 'pine', 'tree', 'sky', 'cloudi', 'white']"
1B8PEPXACAB0.jpg,white mountains surrounded by snow with a slight blue sky with veil like clouds,"['white', 'mountain', 'surround', 'snow', 'slight', 'blue', 'sky', 'veil', 'like', 'cloud']"
1C8BHW8SRI69.jpg,dark mountains with patchy vegetation and the sky is pure white with thick cloud cover,"['dark', 'mountain', 'patchi', 'veget', 'sky', 'pure', 'white', 'thick', 'cloud', 'cover']"
1DPFITOFKQO7.jpg,grey rock mountains with the horizon and the sky is blue and clear,"['grey', 'rock', 'mountain', 'horizon', 'sky', 'blue', 'clear']"
1DTQ4HXF79I1.jpg,mountains covered with green plants and the sky is bright and sunny,"['mountain', 'cover', 'green', 'plant', 'sky', 'bright', 'sunni']"
1FDM4RMXXZ5D.jpg,there is slight green vegetation with mountain range in the background and the sky is slightly blue,"['slight', 'green', 'veget', 'mountain', 'rang', 'background', 'sky', 'slightli', 'blue']"
1GDS2ROKAING.jpg,green mountains with three layers and the sky is white,"['green', 'mountain', 'three', 'layer', 'sky', 'white']"
1GEIYD23XUD9.jpg,stone mountains with ice on top and surrouned with greenery and a blue sky with scattered clouds,"['stone', 'mountain', 'ice', 'top', 'surroun', 'greeneri', 'blue', 'sky', 'scatter', 'cloud']"
1GZO01FY008D.jpg,sharp peaked mountains with brown vegetation and plants in the front and a cloudy sky with dense cloud cover,"['sharp', 'peak', 'mountain', 'brown', 'veget', 'plant', 'front', 'cloudi', 'sky', 'dens', 'cloud', 'cover']"
1IJTITPV37CD.jpg,a huge stone mountain with a pine tree in the front and the sky is dull yellow and has lot of clouds,"['huge', 'stone', 'mountain', 'pine', 'tree', 'front', 'sky', 'dull', 'yellow', 'lot', 'cloud']"
1JE2YGOVQTRA.jpg,mountain range covered with vegetation and a light blue sky with lots of scattered clouds,"['mountain', 'rang', 'cover', 'veget', 'light', 'blue', 'sky', 'lot', 'scatter', 'cloud']"
1KBWZKP2D7AX.jpg,ice caped mountains with green and brown grassland in front with a light blue and clear sky,"['ice', 'cape', 'mountain', 'green', 'brown', 'grassland', 'front', 'light', 'blue', 'clear', 'sky']"
1LUWQ98XZXRN.jpg,mountains covered ith snow and pine trees and the sky is very light blue with no clouds,"['mountain', 'cover', 'ith', 'snow', 'pine', 'tree', 'sky', 'light', 'blue', 'cloud']"
1M51UEAQ8WHS.jpg,yellow mountains with dry vegetation with a blue sky with scattered clouds,"['yellow', 'mountain', 'dri', 'veget', 'blue', 'sky', 'scatter', 'cloud']"
1N1IFVCSM4JE.jpg,sharp snowy mountain peak with orange sunset sky with a tinge of blue,"['sharp', 'snowi', 'mountain', 'peak', 'orang', 'sunset', 'sky', 'ting', 'blue']"
1OSPAMJON6A8.jpg,a huge green mountain surrounded by lush green plant life with a beautiful clear blue sky,"['huge', 'green', 'mountain', 'surround', 'lush', 'green', 'plant', 'life', 'beauti', 'clear', 'blue', 'sky']"
1QEZOKTP3Y16.jpg,a light brown golden mountain with a sandy texture and a clear blue sky with the horizon,"['light', 'brown', 'golden', 'mountain', 'sandi', 'textur', 'clear', 'blue', 'sky', 'horizon']"
1REDQ48TN452.jpg,lush green mountain range with a beautiful blue sky with no clouds,"['lush', 'green', 'mountain', 'rang', 'beauti', 'blue', 'sky', 'cloud']"
1RRUUJ3IKPAU.jpg,green mountain range with a snow capped mountain in the background with light blue sky with clouds,"['green', 'mountain', 'rang', 'snow', 'cap', 'mountain', 'background', 'light', 'blue', 'sky', 'cloud']"
1SM2VVAIVTL0.jpg,mountains surrounded by lush vegetation and the sky is blue and has lots of clouds,"['mountain', 'surround', 'lush', 'veget', 'sky', 'blue', 'lot', 'cloud']"
1SRUP1JCUHTC.jpg,mountain range covered with greenery with a clear blue sky with no cloud cover,"['mountain', 'rang', 'cover', 'greeneri', 'clear', 'blue', 'sky', 'cloud', 'cover']"
1TXYX9OHVLW2.jpg,valley of two mountains which are green and the sky is blue with scattered dense clouds,"['valley', 'two', 'mountain', 'green', 'sky', 'blue', 'scatter', 'dens', 'cloud']"
1U6X5OBTJUHC.jpg,stone mountains covered with green moss like plants and the sky is white with cloud cover,"['stone', 'mountain', 'cover', 'green', 'moss', 'like', 'plant', 'sky', 'white', 'cloud', 'cover']"
1USE7381S6LN.jpg,steep sloped mountains covered with snow and pine trees and the sky is white and full of clouds,"['steep', 'slope', 'mountain', 'cover', 'snow', 'pine', 'tree', 'sky', 'white', 'full', 'cloud']"
1VLABRRDZLEM.jpg,rugged stone mountain with no vegetation with a blue sky with a veil like cloud,"['rug', 'stone', 'mountain', 'veget', 'blue', 'sky', 'veil', 'like', 'cloud']"
1Y8GS9LBDZFV.jpg,snow covered mountains with pine vegetation and the sky is sunset orange has layers of clouds,"['snow', 'cover', 'mountain', 'pine', 'veget', 'sky', 'sunset', 'orang', 'layer', 'cloud']"
1ZLIKTB97WA5.jpg,layers of mountains covered with dense pine forests and the sunset sky is bright golden orange with a few clouds,"['layer', 'mountain', 'cover', 'dens', 'pine', 'forest', 'sunset', 'sky', 'bright', 'golden', 'orang', 'cloud']"
1ZVHW5633FB3.jpg,rock like mountains covered with some grass like plant and a plain blue sky,"['rock', 'like', 'mountain', 'cover', 'grass', 'like', 'plant', 'plain', 'blue', 'sky']"
02WHULI8FWF4.jpg,mountains partially covered with green vegetation forming a valley and the sky is mostly white with clouds,"['mountain', 'partial', 'cover', 'green', 'veget', 'form', 'valley', 'sky', 'mostli', 'white', 'cloud']"
2BCI0NOGQTTK.jpg,stone mountain in the middle of a green forest and the sky is very clear and light blue,"['stone', 'mountain', 'middl', 'green', 'forest', 'sky', 'clear', 'light', 'blue']"
2BMRMZT8DXMG.jpg,pine forest with sonw capped mountains in the background and the sky is bright blue with dispersed clouds,"['pine', 'forest', 'sonw', 'cap', 'mountain', 'background', 'sky', 'bright', 'blue', 'dispers', 'cloud']"
4Q5EW26PDKSO.jpg,dark hills covered with snow with a clear light blue sky,"['dark', 'hill', 'cover', 'snow', 'clear', 'light', 'blue', 'sky']"
4QV9FSK61YSW.jpg,rocky hills with yellow fields and a clear dark blue sky,"['rocki', 'hill', 'yellow', 'field', 'clear', 'dark', 'blue', 'sky']"
4SAKVQYBLDHZ.jpg,dark snowy hills with trees and a cloudy white sky,"['dark', 'snowi', 'hill', 'tree', 'cloudi', 'white', 'sky']"
4SBVGFQ72QM2.jpg,green hills with dense trees with a light blue sky with scattered clouds,"['green', 'hill', 'dens', 'tree', 'light', 'blue', 'sky', 'scatter', 'cloud']"
4SOGFSE8M4FJ.jpg,rocky hills with streaks of snow with a clear dark blue sky,"['rocki', 'hill', 'streak', 'snow', 'clear', 'dark', 'blue', 'sky']"
4T11MCO0LX3B.jpg,two layers of hills covered with trees and a light blue sky with puffy grey clouds,"['two', 'layer', 'hill', 'cover', 'tree', 'light', 'blue', 'sky', 'puffi', 'grey', 'cloud']"
4TXI1F8Y36IK.jpg,low lying hill covered with grass and with a dark blue sky with streaks of white and puffy clouds,"['low', 'lie', 'hill', 'cover', 'grass', 'dark', 'blue', 'sky', 'streak', 'white', 'puffi', 'cloud']"
4VTQQVEDOM5Q.jpg,rocky hill mostly covered with snow and a layer of trees with a grey hazy sky,"['rocki', 'hill', 'mostli', 'cover', 'snow', 'layer', 'tree', 'grey', 'hazi', 'sky']"
4WMHYJX77PBL.jpg,single hill covered with green moss and a light blue sky covered with white clouds,"['singl', 'hill', 'cover', 'green', 'moss', 'light', 'blue', 'sky', 'cover', 'white', 'cloud']"
4X62VSNPQOFW.jpg,rocky hill covered with green bushes with a clear white sky,"['rocki', 'hill', 'cover', 'green', 'bush', 'clear', 'white', 'sky']"
4YZJ68HATMPF.jpg,two layers of hills on a rocky terrain and a clear light blue sky with a white horizon,"['two', 'layer', 'hill', 'rocki', 'terrain', 'clear', 'light', 'blue', 'sky', 'white', 'horizon']"
05LE82SEXUO0.jpg,blue hills along with a hill covered with green moss with a blue sky covered with white puffy clouds,"['blue', 'hill', 'along', 'hill', 'cover', 'green', 'moss', 'blue', 'sky', 'cover', 'white', 'puffi', 'cloud']"
5A13SHIAQ36T.jpg,rocky snow capped hills with peaks and a light blue sky with thin lines of cloud,"['rocki', 'snow', 'cap', 'hill', 'peak', 'light', 'blue', 'sky', 'thin', 'line', 'cloud']"
5A536126RH0I.jpg,green mossy hill with green bushes and a light blue sky scattered with white clouds,"['green', 'mossi', 'hill', 'green', 'bush', 'light', 'blue', 'sky', 'scatter', 'white', 'cloud']"
5AIZ0TC6DOB2.jpg,dark rocky hill covered with snow and a grey sky covered with thin grey clouds,"['dark', 'rocki', 'hill', 'cover', 'snow', 'grey', 'sky', 'cover', 'thin', 'grey', 'cloud']"
5AS7DWKO5TEP.jpg,snow capped rock hill with a clear blue sky,"['snow', 'cap', 'rock', 'hill', 'clear', 'blue', 'sky']"
5B9BGQYGD3Y7.jpg,dark rocky hill covered with green moss and a blue sky with a line of white clouds in the horizon,"['dark', 'rocki', 'hill', 'cover', 'green', 'moss', 'blue', 'sky', 'line', 'white', 'cloud', 'horizon']"
5DFQVK29GV2U.jpg,sandy hill covered with green bushes with a hazy light blue sky,"['sandi', 'hill', 'cover', 'green', 'bush', 'hazi', 'light', 'blue', 'sky']"
5EFJQ4PSQS0K.jpg,rounded hill in a green mossy terrain with a grey sky streaked with white clouds,"['round', 'hill', 'green', 'mossi', 'terrain', 'grey', 'sky', 'streak', 'white', 'cloud']"
5EJSETTTT4KJ.jpg,dark rocky hill with snow scattered around and a blue sky covered with a thick puffy white cloud,"['dark', 'rocki', 'hill', 'snow', 'scatter', 'around', 'blue', 'sky', 'cover', 'thick', 'puffi', 'white', 'cloud']"
5G9G1M4EH6I2.jpg,white rocky hills covered with snow trails and trees and a hazy light blue sky,"['white', 'rocki', 'hill', 'cover', 'snow', 'trail', 'tree', 'hazi', 'light', 'blue', 'sky']"
5JDNT422Y72M.jpg,dark rocky hill covered with green moss and scatted with snow with a grey sky with a cloud on the hill,"['dark', 'rocki', 'hill', 'cover', 'green', 'moss', 'scat', 'snow', 'grey', 'sky', 'cloud', 'hill']"
5K9ZPACAO34P.jpg,two layers of hill covered with dark green moss and a clear light blue sky,"['two', 'layer', 'hill', 'cover', 'dark', 'green', 'moss', 'clear', 'light', 'blue', 'sky']"
9K8Z3UQCUVYB.jpg,road in the foreground leading to a hill in the background and the sky is light blue with a big white cloud,"['road', 'foreground', 'lead', 'hill', 'background', 'sky', 'light', 'blue', 'big', 'white', 'cloud']"
9L9ZRV4J7JD5.jpg,the hills are rocky and green and the sky is light blue with scattered white clouds,"['hill', 'rocki', 'green', 'sky', 'light', 'blue', 'scatter', 'white', 'cloud']"
9LQ3YBA8VOLW.jpg,snow capped hills with greenery in the foreground and a blue sky with a lot of clouds,"['snow', 'cap', 'hill', 'greeneri', 'foreground', 'blue', 'sky', 'lot', 'cloud']"
9P10D5J3OPNC.jpg,cloud covered rocky hill with pine trees in the foreground and white cloudy skies,"['cloud', 'cover', 'rocki', 'hill', 'pine', 'tree', 'foreground', 'white', 'cloudi', 'sky']"
9PCT4Q4V5XLR.jpg,three layers of hills with trees in the foreground and a light blue sky with clouds,"['three', 'layer', 'hill', 'tree', 'foreground', 'light', 'blue', 'sky', 'cloud']"
9Q1L7MYTCDSY.jpg,snow capped hills whihc have a little brown peaking through with a light blue clear skies,"['snow', 'cap', 'hill', 'whihc', 'littl', 'brown', 'peak', 'light', 'blue', 'clear', 'sky']"
9Q9S3ZVVNSGN.jpg,one rocky hill with a little snow and dry vegetation in the foreground and the sky is light blue with very light scattering of clouds,"['one', 'rocki', 'hill', 'littl', 'snow', 'dri', 'veget', 'foreground', 'sky', 'light', 'blue', 'light', 'scatter', 'cloud']"
9R2DK78QMTSR.jpg,grey hills covered lightly in snow with green mossy plains in the foreground with clear blue skies,"['grey', 'hill', 'cover', 'lightli', 'snow', 'green', 'mossi', 'plain', 'foreground', 'clear', 'blue', 'sky']"
9SN8E3YDHA6O.jpg,light green hills with a little melting snow and rocks pine trees in the foreground with white cloudy skies,"['light', 'green', 'hill', 'littl', 'melt', 'snow', 'rock', 'pine', 'tree', 'foreground', 'white', 'cloudi', 'sky']"
9TR07BS8W5EO.jpg,dark hills with a little snow and a blue sky mostly covered with white clouds,"['dark', 'hill', 'littl', 'snow', 'blue', 'sky', 'mostli', 'cover', 'white', 'cloud']"
9ULG5L9EPRG3.jpg,snow capped flat hills with clear blue skies,"['snow', 'cap', 'flat', 'hill', 'clear', 'blue', 'sky']"
9USAO4NPDH8F.jpg,rock tower with a muddy orange path beside it and a clear blue with lightly fluffy clouds,"['rock', 'tower', 'muddi', 'orang', 'path', 'besid', 'clear', 'blue', 'lightli', 'fluffi', 'cloud']"
9WJ8UFCO265Y.jpg,green hills with a very light blue sky,"['green', 'hill', 'light', 'blue', 'sky']"
9YT4NMG5CTPE.jpg,orange brown rocky hills with dark stormy clouds,"['orang', 'brown', 'rocki', 'hill', 'dark', 'stormi', 'cloud']"
13MX2AZU4VB6.jpg,cloud covered snowy hills with pine trees and a plain in the foreground and the sky is clear and light blue,"['cloud', 'cover', 'snowi', 'hill', 'pine', 'tree', 'plain', 'foreground', 'sky', 'clear', 'light', 'blue']"
18G0BRHYKQJO.jpg,faded hills due to mist with a rocky foreground with vegetation with a clear gradient skies with a tinge of orange,"['fade', 'hill', 'due', 'mist', 'rocki', 'foreground', 'veget', 'clear', 'gradient', 'sky', 'ting', 'orang']"
19E8OA99W6WJ.jpg,big white hill covered in snow surrounded by smaller snow capped hills with azure skies,"['big', 'white', 'hill', 'cover', 'snow', 'surround', 'smaller', 'snow', 'cap', 'hill', 'azur', 'sky']"
20E6RPE2TBO7.jpg,green hills to the left and rocky slightly snowy hills to the right with clear white skies,"['green', 'hill', 'left', 'rocki', 'slightli', 'snowi', 'hill', 'right', 'clear', 'white', 'sky']"
21W9HHU37PER.jpg,rocky dark hill with a little snow in the foreground and hill ranges with clouds in the background with clear white skies,"['rocki', 'dark', 'hill', 'littl', 'snow', 'foreground', 'hill', 'rang', 'cloud', 'background', 'clear', 'white', 'sky']"
26CSWEKTG1V7.jpg,dark rocky hill covered in snow and fluffy clouds with fluffy white cloud with dark blue sky,"['dark', 'rocki', 'hill', 'cover', 'snow', 'fluffi', 'cloud', 'fluffi', 'white', 'cloud', 'dark', 'blue', 'sky']"
26I79HKYS5ON.jpg,green plains in the foreground  with small hill in the distance with a very light blue sky with scattered clouds,"['green', 'plain', 'foreground', 'small', 'hill', 'distanc', 'light', 'blue', 'sky', 'scatter', 'cloud']"
26ZJ0MLQBUHQ.jpg,brown rocky hills in the background with grassland in the foreground with a few pine trees with a light blue skies mostly covered with clouds,"['brown', 'rocki', 'hill', 'background', 'grassland', 'foreground', 'pine', 'tree', 'light', 'blue', 'sky', 'mostli', 'cover', 'cloud']"
27T11DEK1FA1.jpg,rocky trail in the mud leading upto hills in the background and cloudy skies with a little blue,"['rocki', 'trail', 'mud', 'lead', 'upto', 'hill', 'background', 'cloudi', 'sky', 'littl', 'blue']"
29BRUM5TQUQA.jpg,snow covered plain with pine trees and blue skies with light white clouds,"['snow', 'cover', 'plain', 'pine', 'tree', 'blue', 'sky', 'light', 'white', 'cloud']"
30MZ37GI2NZJ.jpg,rocky white hills in the distance forest of pine trees in the front of them with a sky that is clear blue,"['rocki', 'white', 'hill', 'distanc', 'forest', 'pine', 'tree', 'front', 'sky', 'clear', 'blue']"
32OD8G15107X.jpg,dark rocky hill with a little snow and pine trees in foreground with white cloudy skies,"['dark', 'rocki', 'hill', 'littl', 'snow', 'pine', 'tree', 'foreground', 'white', 'cloudi', 'sky']"
34AJIKTT3KU9.jpg,rocky hill covered in moss with green plains in the far background and a sky that is clear blue,"['rocki', 'hill', 'cover', 'moss', 'green', 'plain', 'far', 'background', 'sky', 'clear', 'blue']"
36DRZ93WJK0T.jpg,dark hills in the distance with trees and grasslands in the foreground and a cloudy sky with ribbon like clouds,"['dark', 'hill', 'distanc', 'tree', 'grassland', 'foreground', 'cloudi', 'sky', 'ribbon', 'like', 'cloud']"
37FICWFF3FMR.jpg,rocky hills int he distance covered with clouds and pine forest in the foreground and a sky is light blue with big fluffy clouds,"['rocki', 'hill', 'int', 'distanc', 'cover', 'cloud', 'pine', 'forest', 'foreground', 'sky', 'light', 'blue', 'big', 'fluffi', 'cloud']"
37RRQKDU6MCG.jpg,gradient blue hill ranges covered in mist and fog with a few darker hills in the foreground and a clear slightly dark blue skies,"['gradient', 'blue', 'hill', 'rang', 'cover', 'mist', 'fog', 'darker', 'hill', 'foreground', 'clear', 'slightli', 'dark', 'blue', 'sky']"
38YO55BC8YQ4.jpg,snow capped hill with grasslands and pine trees in the foreground with a clear blue skies,"['snow', 'cap', 'hill', 'grassland', 'pine', 'tree', 'foreground', 'clear', 'blue', 'sky']"
44V3FU1GYGIA.jpg,green-blue hill ranges with a orange white cloudy skies,"['green-blu', 'hill', 'rang', 'orang', 'white', 'cloudi', 'sky']"
50O1ITLNOK7D.jpg,boulder like rocky hills covered in grass and moss with a grass patch in the foreground with clear blue skies,"['boulder', 'like', 'rocki', 'hill', 'cover', 'grass', 'moss', 'grass', 'patch', 'foreground', 'clear', 'blue', 'sky']"
50ZZUWYKGONT.jpg,grasslands leading upto rocky hills with clear blue skies,"['grassland', 'lead', 'upto', 'rocki', 'hill', 'clear', 'blue', 'sky']"
0000018.png,blurry blue hills and dark trees,"['blurri', 'blue', 'hill', 'dark', 'tree']"
6BLNCGLN3T4P.jpg,rocky hills in the distance and green covered hills in the forefront with blue cloudy skies,"['rocki', 'hill', 'distanc', 'green', 'cover', 'hill', 'forefront', 'blue', 'cloudi', 'sky']"
0072878.png,brown rocky mountains with light brown and dark brown gradients and faded hill in the distance and a clear blue sky,"['brown', 'rocki', 'mountain', 'light', 'brown', 'dark', 'brown', 'gradient', 'fade', 'hill', 'distanc', 'clear', 'blue', 'sky']"
0050566.png,snow capped mountain with a little greenery at the bottom with clear white skies,"['snow', 'cap', 'mountain', 'littl', 'greeneri', 'bottom', 'clear', 'white', 'sky']"
6HGAZGKV8DB3.jpg444444444444444444444444444444444444444444444444444444444444444444444444,snow capped hills in the distance with snow and foliage in the forefront and clear blue skies,"['snow', 'cap', 'hill', 'distanc', 'snow', 'foliag', 'forefront', 'clear', 'blue', 'sky']"
0050982.png,green pastures leading up to a green hill with a stormy dark sky,"['green', 'pastur', 'lead', 'green', 'hill', 'stormi', 'dark', 'sky']"
0050981.png,rocky brown hill with sparsed vegetation and a light blue clear sky,"['rocki', 'brown', 'hill', 'spars', 'veget', 'light', 'blue', 'clear', 'sky']"
06SWFA8XYRFU.jpg,green hills leading to dark hills with a clear blue sky,"['green', 'hill', 'lead', 'dark', 'hill', 'clear', 'blue', 'sky']"
0051068.png,brown hill in the forefront and a hill covered with clouds behind it with white cloudy skies,"['brown', 'hill', 'forefront', 'hill', 'cover', 'cloud', 'behind', 'white', 'cloudi', 'sky']"
0051030.png,green and rocky mountains with a clear blue sky,"['green', 'rocki', 'mountain', 'clear', 'blue', 'sky']"
6JWREFT0B2KG.jpg,brown rocky hills and a clear blue sky with a small cloud,"['brown', 'rocki', 'hill', 'clear', 'blue', 'sky', 'small', 'cloud']"
5Z5SDJHGM7DA.jpg,green low lying hills with cloudy skies,"['green', 'low', 'lie', 'hill', 'cloudi', 'sky']"
0050995.png,dark green hills with a warm white sky,"['dark', 'green', 'hill', 'warm', 'white', 'sky']"
06QRXVG2WWCO.jpg,snow covered mountain witha  blue sky which has orange clouds so sunrise or sunset,"['snow', 'cover', 'mountain', 'witha', 'blue', 'sky', 'orang', 'cloud', 'sunris', 'sunset']"
0051045.png,sandy brown terrain leading upto a low lying sandy brown hill with blue skies with scattered clouds,"['sandi', 'brown', 'terrain', 'lead', 'upto', 'low', 'lie', 'sandi', 'brown', 'hill', 'blue', 'sky', 'scatter', 'cloud']"
5WMK6US64ONV.jpg,white snow covered mountain covered with light wispy clouds and blue skies,"['white', 'snow', 'cover', 'mountain', 'cover', 'light', 'wispi', 'cloud', 'blue', 'sky']"
5MK4YDP9BNL2.jpg,white snow capped hills covered with fog and clouds and a dark white cloudy sky,"['white', 'snow', 'cap', 'hill', 'cover', 'fog', 'cloud', 'dark', 'white', 'cloudi', 'sky']"
5RW4MO879UES.jpg,green foliage covered hills in the foreground and a cloud covered mountain in the distance and a white cloudy sky,"['green', 'foliag', 'cover', 'hill', 'foreground', 'cloud', 'cover', 'mountain', 'distanc', 'white', 'cloudi', 'sky']"
0051044.png,rocky grey mountain lightly covered in snow with dark blue skies and scattered clouds,"['rocki', 'grey', 'mountain', 'lightli', 'cover', 'snow', 'dark', 'blue', 'sky', 'scatter', 'cloud']"
0051042.png,light grey hills with light foliage and clear blue sky,"['light', 'grey', 'hill', 'light', 'foliag', 'clear', 'blue', 'sky']"
0050562.png,green trees in the foreground and dark grey mountians and a clear blue sky,"['green', 'tree', 'foreground', 'dark', 'grey', 'mountian', 'clear', 'blue', 'sky']"
0051013.png,green fields in the foreground with dark grey hill covered in clouds,"['green', 'field', 'foreground', 'dark', 'grey', 'hill', 'cover', 'cloud']"
6MTT9C9WRCLS.jpg,green fields in the foreground with a dark grey hill and a sky with dark grey white clouds,"['green', 'field', 'foreground', 'dark', 'grey', 'hill', 'sky', 'dark', 'grey', 'white', 'cloud']"
6MUMOCUVSO07.jpg,white hill with crisp clear blue skies,"['white', 'hill', 'crisp', 'clear', 'blue', 'sky']"
6J54GSNKO5GD.jpg,low lying regions of the hill has greenery and the top part is covered in snow and a light blue sky with clouds,"['low', 'lie', 'region', 'hill', 'greeneri', 'top', 'part', 'cover', 'snow', 'light', 'blue', 'sky', 'cloud']"
0050998.png,snow and cloud covered mountains with a light blue sky,"['snow', 'cloud', 'cover', 'mountain', 'light', 'blue', 'sky']"
6B7AQ60KY99V.jpg,dark grey olive green rocky mountain covered in snow and light grey clouds,"['dark', 'grey', 'oliv', 'green', 'rocki', 'mountain', 'cover', 'snow', 'light', 'grey', 'cloud']"
0051064.png,greenery in the foreground with hills with orange light in the background with clear skies,"['greeneri', 'foreground', 'hill', 'orang', 'light', 'background', 'clear', 'sky']"
5VY4X5VJTT81.jpg,fog covered light brown hill with clear cloudy skies,"['fog', 'cover', 'light', 'brown', 'hill', 'clear', 'cloudi', 'sky']"
0051063.png,grey hills with clouds and foliage and a clear blue sky,"['grey', 'hill', 'cloud', 'foliag', 'clear', 'blue', 'sky']"
0050988.png,greenery covered hills with dark grey sky,"['greeneri', 'cover', 'hill', 'dark', 'grey', 'sky']"
6HU37VMQOI5U.jpg,light grey hills covered in light foliage with a pink purple sky sunrise or sunset,"['light', 'grey', 'hill', 'cover', 'light', 'foliag', 'pink', 'purpl', 'sky', 'sunris', 'sunset']"
6A1V68IT3VQR.jpg,dark grey base in the forefront and a grey hill in the back with light snow on the tops with a clear blue sky,"['dark', 'grey', 'base', 'forefront', 'grey', 'hill', 'back', 'light', 'snow', 'top', 'clear', 'blue', 'sky']"
6HERO9L7KVX7.jpg,dark hills with pine trees silhouttes in the front and a light orange sky sunrise or sunset,"['dark', 'hill', 'pine', 'tree', 'silhoutt', 'front', 'light', 'orang', 'sky', 'sunris', 'sunset']"
5TL0VMOB5AGB.jpg,light grey hills covered in snow with a light clue purple sky covered in clouds,"['light', 'grey', 'hill', 'cover', 'snow', 'light', 'clue', 'purpl', 'sky', 'cover', 'cloud']"
